{
  "$schema": "http://json-schema.org/draft-07/schema#",
  "$id": "https://cursor.sh/schemas/cursor-plugin.schema.json",
  "title": "Cursor Plugin Manifest",
  "description": "Schema for .cursor-plugin/plugin.json — the manifest Cursor IDE reads when installing a plugin.",
  "type": "object",
  "required": ["name", "version"],
  "additionalProperties": false,
  "properties": {
    "name": {
      "type": "string",
      "pattern": "^[a-z0-9]([a-z0-9.-]*[a-z0-9])?$",
      "description": "Plugin name in lowercase kebab-case"
    },
    "displayName": { "type": "string" },
    "description": { "type": "string" },
    "version": {
      "type": "string",
      "pattern": "^[0-9]+\\.[0-9]+\\.[0-9]+([.-].+)?$"
    },
    "author": {
      "oneOf": [
        { "type": "string" },
        {
          "type": "object",
          "required": ["name"],
          "properties": {
            "name": { "type": "string" },
            "email": { "type": "string", "format": "email" }
          }
        }
      ]
    },
    "homepage": { "type": "string", "format": "uri" },
    "repository": { "type": "string" },
    "license": { "type": "string" },
    "keywords": {
      "type": "array",
      "items": { "type": "string" }
    },
    "skills": { "$ref": "#/definitions/pathOrPaths" },
    "rules": { "$ref": "#/definitions/pathOrPaths" },
    "agents": { "$ref": "#/definitions/pathOrPaths" },
    "commands": { "$ref": "#/definitions/pathOrPaths" },
    "hooks": {
      "oneOf": [
        { "type": "string" },
        { "type": "object" }
      ]
    },
    "mcpServers": { "$ref": "#/definitions/pathOrPaths" }
  },
  "definitions": {
    "pathOrPaths": {
      "oneOf": [
        { "type": "string" },
        {
          "type": "array",
          "items": { "type": "string" }
        }
      ]
    }
  }
}